id,flag,title,content
69c8fec5a50d4d9a825e0326a93bd24b,0,此主帖已经被老玩童9设为精华帖帖子标题：陪伴是最长情的告白！秦皇岛奶爸喜提别克GL8 ~简单实用性改装！精华理由：精华！,此主帖已经被老玩童9设为精华帖帖子标题：陪伴是最长情的告白！秦皇岛奶爸喜提别克GL8 ~简单实用性改装！精华理由：精华！
2fecc471f10b44e8930724ae2fc81707,0,从照片上看车子很板正,从照片上看车子很板正
a3267ff19e05476cba1d3ceabe4af39a,0,打算什么时候买？一起的。,打算什么时候买？一起的。
16b46f7d243b45cc87c863041afd5f99,1,大v的车门异响问题,                  hello大家的大v有车门异响问题吗我刚开始提车真是一点不响后来有一点响现在越来越响有咔咔和吱扭声大神们是如何解决异响的请指教支招                      
56bcd67fb2134f31a6b838faa5392d1f,1,大爱埃尔法黑色内饰，真心很好看！！！,                                                                   
b26c0765f2eb475c9a37c33d3cac9426,0,大灯开关那里有一个左边或者右边的灯，你旋转一下试试，就可以明白怎么操作的了！,大灯开关那里有一个左边或者右边的灯，你旋转一下试试，就可以明白怎么操作的了！
6ee6112fd4e2419ab9d706c2965a6a50,0,大哥，闲鱼搜索小丁爱梦丽，什么不懂你在问店主，他家宝贝真的好亲民！就说朋友介绍有优惠！,大哥，闲鱼搜索小丁爱梦丽，什么不懂你在问店主，他家宝贝真的好亲民！就说朋友介绍有优惠！
f7b61d511ab74a0a9f5e5408433b5371,0,大家福利又来了，威霆改装260仪表台来货了！档次提升不少,　　真的质量很棒！效果也好！闲鱼小小丁爱梦丽！自己问    
5d37d67213f4472da36cec9963a71086,1,大家评评理,                  我只是发表“家用带孩子建议豪华版”被删，相信大部分人都认可，因为中间有过道比较方便，退一步讲，就算不对，我也是个人建议，这也删，论坛还有意义吗                                                 
476d503574ac41a2a1a9609cdb703f7a,0,大屏1米出库0.3加保险,大屏1米出库0.3加保险
22b3ec0fd9de48c38c8990fc92742b46,0,大神们低配大灯改米石好，还是换高配LED好？,
e3375831a053440e86f3f0102b4e4017,1,大众多年不变的外形和动力拖累了迈车的销量！,　　这迈车要动力再增加些，比如上2.5T或高功率2.0T，内饰再精致豪华一些，外形稍稍圆润点，那销量真的会上很多，现在许多买GL8的都是看中了它的动力和外形，有许多小老板不弄奔驰平时就喜欢开GL8，主要是应用面比较大，开起来又不累赘！
48241c45970d4b77b3f734d63871e165,0,大众迈特威广东省或深圳有微信群吗,　　今天准备提四驱探索版 希望大家多交流用车心得  
34995c0b460c45aabee3df84110dea59,0,贷款买车太划算了，俩年免息，真好,贷款买车太划算了，俩年免息，真好
528074d37768494c9770543e2cd79d9f,1,单开电动门 永远的硬伤,单开电动门 永远的硬伤
019af12177fe4054b7327efad1f1f70f,0,但是改完了以后年检能过吗,但是改完了以后年检能过吗
8cdf85dc49984bb3bd4f8746aefc3073,0,当然能注册，我都注册了，但上海这边要审核升级成专车你才能补贴点。注册可以，当快车跑铁定赔。,当然能注册，我都注册了，但上海这边要审核升级成专车你才能补贴点。注册可以，当快车跑铁定赔。
8c5aca74f71d4e86b2b1f2d12b0db5b8,1,倒车影像异常关闭,                  刚买V260??一个多月，挂入倒档后倒车影像不启动，中央大屏显示倒车影像无法启动，第一次出现后弄不好，熄火后过一段时间重启又好了，今天第二次又出现了，请问大家出现过这种情况吗？怎么解决的？先谢谢了                                                 
23469c2c1f9942c59414f2c536eb3f14,1,等红灯D档自动跳P档,                  v260气囊老故障等红灯D档自动跳P档晕阿4s店查出问题求神们解各位有没有同样问题                      
a5bce05f65c84ca3bd54e25097e578cc,0,等着版主给精华,等着版主给精华
8e7ed06475ec4cef9cc0bd15ac3a8fa5,0,低价转让18款奔驰威霆全套升级改装配件,　　低价转让18款奔驰威霆全套升级改装配件 　　18款奔驰新威霆全套升级改装配件低价转让！ 　　LED流光转向一抹蓝原车大灯，大屏导航，升级奔驰V260实心大标中网，升级豪华航空座椅座椅专用滑道滑块，行李架，侧踏，迎宾亮条，主驾驶副驾驶门槛条，车窗亮条，尾门双亮条，尾门后护板，4S原厂手缝方向盘套，专车专用挡泥板，原厂带标拉手，联系电话15043928889秦先生，非诚勿扰。 
d72ab1f9d83540b28e93cc5ec20642aa,0,底盘车什么价,底盘车什么价
6a301be451db42a28f2219d21edb171e,0,底盘问题，百度承载式，和非承载式,底盘问题，百度承载式，和非承载式
477ec3a779e34dfe894204217ac7360f,0,地板自己趟,地板自己趟
2611416a254149cca63d717e6cf06f7f,0,第二代GL8碰撞测试结果并不差！,第二代GL8碰撞测试结果并不差！
fe76e8385ac14394a8c1589b7d597671,1,第一次写汽车之家，迈特威的使用感受,                  从买揽胜就开始养成逛论坛，学会潜水模式，今年3月份提的揽胜，在天津港朋友手里买的，如果不是在那有朋友，估计就是被坑了，水确实很深，后来朋友和他们老板沟通后，一切ok，也很顺利。由于家里人比较多，准备入手一台MVP，其实当初是想买塞纳，由于地理环境和安全原因，毕竟远门都是它，首选就是4驱，老婆第一眼看到就说丑，空间压抑，并不是说塞纳不好，绝对是MVP中的神车。奔驰V的话，由于是福建产的还是后驱就没再考虑范围内，后来买车计划搁浅了，直到有一天无意间一个朋友推荐，说迈特威，第二天直接去4S店看车，老婆一眼相中了，有些时候我真是觉得女人就是外表控，再就是迈特威这车的外观，真是仁者见仁智者见智吧，有朋友说我神经病，有朋友说有内涵，总结说明一下就是个有内涵的神经病。论坛里做了些功课，当时内心也是很矛盾的，噪音大，发动机，变速箱，减震硬等问题，有种感觉好像这个车出厂就是事故车，不过本人不信邪，第三天定金交好，坐等车到。这是提车的当天按地板，惨不忍睹，后来干脆不看了，言归正传吧，说一下感受吧提车到今天不到10天开了两千公里，其实噪音我觉得还可以，能接受！但是120以上确实风噪声很大，目前跑过一次高速来回一千公里，由于还在磨合，转速一直控制在3000左右，一路180悬挂调到S很稳，弯道并没有感觉开的是台MVP。舒服性的话，跟揽胜肯定没法比，不过之前本人有一台fx35，也是刚出手，跟它对比的话，我觉得比较舒服。陪伴我8年，从来没坏过。车无完车，迈特威无论是外表还是内饰，不是乍一眼看就绽放光芒，但只有拥有才知道它的内在精华，开起来很舒服，视线好，布局很简单，但却很实用。变速箱和发动机质疑的人很多，但我觉得既然还能生产这台车，一定是有道理的，变速箱换挡速度很快，低速目前为止没有任何顿挫感，发动机带着2.5吨的车也丝毫感觉不到吃力。当然缺点也是有的，起步自动落锁，锁车后视镜折叠，一键启动，还有最鸡肋的手刹，大手刹！啰里啰嗦这么多，我觉得，没有完美的车，只有适合自己才是最好的。第一次发帖，文采也一般，大家凑合看吧。包括可能大家关心的问题，实木地板异响等问题，本人铺以后效果很好，暂时也没有任何异响，噪音绝对在你接受范围内，当然不要和BBA顶级比，毕竟它是台功能车。                                                 
5c928842aa0a46399045bb5af29c1444,0,电池不是通用制的，是风帆股份,电池不是通用制的，是风帆股份
8a4e7a5ed9d4473bab60e0794e4f7238,1,电动门关不上,　　昨天买的车，请教下大神们。一侧电动门快合拢的时候突然弹开回到原位。有时候关三四次才能关上。s店说感应器敏感需重新调下，会不会是卡锁锁不住？因为回老家离s店太远，得过完年再去 
056ab95c2bde47b79c1e92e8e7fb5757,0,电门无所谓 . 主要就是内饰大屏幕 . 喜欢,电门无所谓 . 主要就是内饰大屏幕 . 喜欢
b9013441e72241c5a16f0686cb153223,0,掉的太快了哈哈,掉的太快了哈哈
cfe08db134a44024a78824ae216dcb15,0,定的25s尊贵下周到但出厂日期可能是18年12月份的可以吗,　　今天销售说下周车可以到，但由于我想要的25s琥珀金马上停产所以几乎没有现车，最后给我联系了一下外省经销商说是还有，但出厂日期可能不是特别近，有可能是18年底出厂的，不知道还可不可以提车   　　心里悬着不托底 
b6af9c39301c47d3897b26cdc49f6c08,0,都是金属漆，白色也是，白色叫白珍珠，其它的白不是金属漆,都是金属漆，白色也是，白色叫白珍珠，其它的白不是金属漆
9ca24b3688e442eb9fa691869086e0c9,1,独立航空座椅哪位老板都舒服,　　独立航空座椅哪位老板都舒服       
e8335e7ebdb24247b7c2dc900b4c4cea,0,"对的，厂家送的首保和二保，工时费和材料费全免的，放心吧，提车后的半年或者5000公里免费首次保养，时间和里程哪个先到为准,别听4s忽悠，首保不要那么早去，你首保提前了，之后的保养周期也要相应的提前，不划算的，按保养手册的要求来就可以了，以厂家的要求为准，","对的，厂家送的首保和二保，工时费和材料费全免的，放心吧，提车后的半年或者5000公里免费首次保养，时间和里程哪个先到为准,别听4s忽悠，首保不要那么早去，你首保提前了，之后的保养周期也要相应的提前，不划算的，按保养手册的要求来就可以了，以厂家的要求为准，"
d9cc2c5eda3b4114b20487f5747908bd,1,对的，威霆的内饰真心要吐槽一下V级的内饰买来的时候还可以，但是有人也愿意改的,对的，威霆的内饰真心要吐槽一下V级的内饰买来的时候还可以，但是有人也愿意改的
4decc71bbce94c27882ec8c32467d776,0,多少米？改,多少米？改
729c54784b724c6b9861e5f015df3d65,0,多少钱？联系方式？,多少钱？联系方式？
e76f0a078ce5410ebd2d3cddadd7e91d,0,多牙儿，都是一些小改装店,多牙儿，都是一些小改装店
c70205029bec4c3699852c1534e0fd4f,0,二手车价有地区差异，并且差别可能会比较大，建议参考二手车之家中本地车友的报价。,二手车价有地区差异，并且差别可能会比较大，建议参考二手车之家中本地车友的报价。
870df4af7a3c492bb4531c9a93345a0b,0,二手车其实你可以去二手车网站看看同样车况和里程的车价格参考一下嘛，网上的价格减少一些就是了。试驾实车车况决定价值。,二手车其实你可以去二手车网站看看同样车况和里程的车价格参考一下嘛，网上的价格减少一些就是了。试驾实车车况决定价值。
6e08a1d1d64d4e45ac13c357ef64c98c,0,发点美食发点车,　　一、吃的                 　　二、车            　　最后以GL8结束作业
0dc051237f974758a60db0138cdbcdf4,1,发动机故障灯，熄火隔段时间就灭了，电脑检测是燃油系统问题，更新就好了,发动机故障灯，熄火隔段时间就灭了，电脑检测是燃油系统问题，更新就好了
14d3fe9fc32a4181b0d73fd955e2654b,0,发个纯娱乐贴，大家看看,
e4142d3ab3b249118914e8567a0607ac,0,翻新别克牌陆尊货车,　　翻新别克牌陆尊货车 　　爱卡币+20 　　共获得爱卡币 　　处女贴不知道从哪说起! 　　先自爆家门!05陆尊3.0，银色，开大半年了啥T不知道，买的二手的，一眼相中，开了1公里直接交钱开走，没犹豫，不墨迹，买完一星期偶然发现，我擦，263848公里，没关系，大几十万公里的还在跑，不怕，偶然又发现，我擦!第一手北京租赁公司的，算了，开吧，车不错，开着得劲管它呢。 　　不过确实不错，啥毛病没有，从买来到现在就换了四条轮胎，换了次机油别的啥也没动，大半年只开了5000多公里，还包括几次长途共3000公里，要是不跑长途半年也就2000公里，就是压地头，小城镇 上图看看  　　刚买车照的  　　到现在也没有几张照片 　　当时看中的就是好看空间大(本人搞批发的)，独立座椅，跑长途舒服，宜家宜商，拆了座椅就是货车，装上就是商务，太特么灵活了，  　　大半年只去洗车店一次哈哈哈哈还是为了把洗车卡的钱用光哈哈哈，因为我结婚搬家外地了 　　昨天把座椅全拆了，店里正装修，先当货车用一阵吧，石膏板，木方，垃圾全用这小子拉了，  　　遛狗时照的一张 　　这车就不准备卖了，等个20年给我儿子留着开哈哈哈，所以准备翻新一下，没有太多时间专门弄，只能有时间一点一点打理，我比较喜欢自己动手  　　现在求助论坛大神助我一臂之力， 　　准备翻新项目1:车身改色(准备改晶灰了) 　　2:升级17寸经典多条幅轮毂(能无损升级吗) 　　3:内饰全部翻新(阅读灯、顶棚、车门内饰板、更换地板)求强力强力去污渍的东西，再问一嘴内饰板能不能无损更换XT的?如果能我就直接闲鱼 　　4:开缸剖腹!   最重要的，现在车声音大，凉车有点突突，车热了马上就好，感觉劲头不足，加速气门还有点响 　　6:变速箱:估计一直没换油，40以下顿挫明显，窜车，40以上无缝连接，非常舒服 　　5:大灯，原车主改了氙气大灯，远光不好用，求改灯方案 　　昂对了，全车喷漆应该是拆了所有能拆的覆盖件单独喷漆还是不用拆车门直接喷?我问过一个钣金喷漆的说不用拆，直接喷3500块!  　　苦了这车了，全是灰  　　，有没有人知道这个安卓机最左侧的按键光怎么调?晚上全靠蒙!  　　内饰板磨损，与胶条间隙大，中门手指头都能塞进去  　　出风口爪子也断了，满目疮痍  　　翻新一下自己开着也舒服，有趣点   　　后排空调不好使了，就缺个东西，红圈里的咱也不知道叫啥，闲鱼了一下，拆车450块，特奶奶的!必须换面板总成。有时候颠的厉害了后面空调呼呼的好使了，过会又没有了，抽疯一样，有没有电路大神教教我不换面板总成怎么能好使 　　第一次发帖好紧张啊，感觉说的无厘头了!刚说完头发说屁股，说完了屁股转到胸，胸完事直接脚丫子，然后脚底抹油咻咻咻溜了哈哈 　　好了就这样吧，想到什么再补充 　　另烦请各位前辈告知本人所有翻新的注意事项，希望各位知无不言，言无不尽，在下不胜感激。
5a5c9eb90b4341a88b5ce4b49c4cd850,1,反复比较反复纠结，终于提车记了,"　　去年11月关注GL8新款配定金都交由于电子助力问题果断退出然后就在艾力绅.威霆.胖鱼头.老8之间纠结艾力绅空间理想威霆后期保养贵老8粗糙后来听说胖鱼头要出新款于苦苦等待……3月5号SSSS销售员打电话说可以定车基本没有太犹豫交定金14号琥珀金车到店,15号提车 "
230fe06a618b46f28aabcfa6ebc391e5,1,方向打死蹦蹦响,　　各位大神，我的v260方向打死时，不管是倒车还是前行，听着轮胎蹦蹦响是怎么回事，谢谢！
a72b763370034673aa01c3c94f9e8dcf,0,放假了，又满满一车,　　么也不说了   　　走着
2948e536bb644885a4f767dddf3c1969,0,非常感谢。,非常感谢。
d9b53a87952342a78afee31d083008a4,0,分享一下购车详情,分享一下购车详情
be9357d9d0824724ac13505ea78c8cc7,0,氛围灯问题，请专家指导,                                      请问我新买的260加长版的，国&#xeca8;的，氛围灯怎么&#xed6c;亮啊                      
aa4d09727d5740bc9a3be77a71b1669d,0,丰田埃尔法改装蒙娜丽莎小包围,　　丰田埃尔法改装蒙娜丽莎小包围 　　丰田埃尔法改装蒙娜丽莎小包围 　　适合车型：丰田埃尔法 　　适合年份：18- 　　材质：注塑PP 　　组件：前唇 侧裙门板 后唇（安装附件）    
6e79eafd5ae3491a8541e0a558a98dd0,0,丰田埃尔法装AP8520大六活塞刹车卡钳套装搭配370盘,　　埃尔法装上AP8520大六活塞刹车卡钳套装，出现刹车抖动，换上ECFRONT品牌刹车盘，解决了抖动这一问题。         
8ea75f41a551427a90708339c53b16d4,0,佛山有没有GL8es商务交流群？,
826b8dd815d54b41b04ed6ac4aa1a208,1,福奔最脑残的设计,　　所谓级航空座椅调节按键还有前后移动把手样位置奔驰级工程师怎么解释市场主流MPV就没这么设计包括丰田艾尔法众迈特威别克GL8本田艾力绅奥德赛细心朋友可以关注
4ed2239e8bd7478b8a970e79bbfc813b,1,福利：V260 2018款 即将上市,　　打算今年提一辆 V260 作为商务和家庭用车，年前在店里看了实车，发现各个功能不比阿尔法差多少，豪华感也不错，性价比高，也看过好多商务，比如1阿尔法永久性加价   2 GL8 单侧电动门 太low   3.看到广汽传祺GM8，确实综合比太高了，就是牌子不过硬，内饰只有米色一种，最终还是决定V260 　　给即将要提V260 的老板们福利，打探到福建奔驰内部消息，有所改动 　　1.2018款将于5月份上市 　　2.发动机变更 　　3.后玻璃可以单独打开  
18734c6a30db479dbc1dbe02d9d4d145,1,该楼内容已经被屏蔽！我要提意见,　　沙发 　　该楼内容已经被屏蔽！我要提意见
31e43d6b86934cfbad0b671f08935a46,0,改的还真可以,改的还真可以
cf4176fb45c94d0988e14a3b3bfcf7f2,0,改的太多了，可以发个清单吗，关注了,改的太多了，可以发个清单吗，关注了
0b33ec75ffb74f3f9d9d69203965da88,0,改过轮毂的指教一下,　　请问威霆改20寸前后配的轮毂可以吗？能装的上吗？米其林245/40/20舒适性怎么样
6462c4fd7e994a11bab27e589c6dc19c,0,改款会有混动版吗？,　　改款会有混动版吗？
4884641b56874c9bbadb4878f436f31f,0,改了能前后移动还是很方便的，就不说哪家买的吧，免得说我是黑，但是总觉得第三排有异响，具体位置找不到，感觉摇第三排就点晃动，不知道是大家都有这情况，还是我点背一个人有这种情况,改了能前后移动还是很方便的，就不说哪家买的吧，免得说我是黑，但是总觉得第三排有异响，具体位置找不到，感觉摇第三排就点晃动，不知道是大家都有这情况，还是我点背一个人有这种情况
78a4f1a390d441bdb8bc2785ddff2d81,0,改两个电动门钱,改两个电动门钱
606bbe446b46403b8afb3a41cb3df025,0,改装2.5老八后排座椅，三座变独立两座之终结篇,　　改装2.5老八后排座椅，三座变独立两座之终结篇 　　爱卡币+20 　　共获得爱卡币 　　也许有卡友已经看过前3篇了  　　我肯定被不少路过潜水的骂过。不过既然开了头就必须要做完，这回就给大家看看绝无仅有的GL6吧 　　前篇已经完工了一个主驾侧座椅，另外一边基本步骤是一样一样的。这边的改装过程就简单一点了，毕竟已经有了点经验积累嘛  　　坐垫骨架  抛弃原厂的靠背调节器  　　准备把调节器装在靠窗户侧  增加过道宽度  　　连接靠背骨架并增加固定件  　　成功实现平躺  前篇完工的不能平躺需要返工了  　　坐垫穿衣服  　　两侧都是新买的调节器主副支架  　　抛弃原来的调节器 改造一下就可以实现靠背角度0-180度快调   　　准备装车，请忽略扎带哈  　　安装过程会比原来大三座费劲些，毕竟没有了原先的重力优势  　　连体变成两兄弟  　　左侧调节器主支架占用过道太多，换  　　靠窗侧这个位置刚好放下靠背调节器主支架   　　我们来聊聊楼主这脑子有坑  　　过道偏窄  　　大三座变两座  他媳妇都骂他了  　　主驾侧调节器换到靠窗以后  　　最窄的过道位置 　　也不总结了，傻就sha了吧唧 　　最后惯例  　　玻璃栏杆加木踏板  　　石材踏步加玻璃栏杆  　　至少五十度白酒配鸡腿
0a3647ab11ce4bd5a7b5fbfe46e23775,0,改装大神求指点,                                      想入手esgl8纠结2899还是3699求指点2899升级原厂中央扶手，电动真皮座椅，座椅加热，电动中门尾门，原厂led大灯大约&#xec6c;&#xed39;钱                      
a827280c15874f68b732897b4605632d,0,改装多少钱？,改装多少钱？
2ed33ded631345c5ae481d54f08e891e,0,改装后，，怕响？,改装后，，怕响？
89ccbba31f544d9b97df362763013b90,0,改装几钱？,改装几钱？
0528c054323b494a94a1c5ff9064c514,0,改装就是一场艳遇，艳的是车遇的是人,　　大家好，我提车有半个多月了，之前在网上找的这家专业改装GL8的店家，在网上打电话约好之后他们把货发过来之后，不到两天就过来了，改装师傅的干活效率不错的，两天就改装完工了， 　　2899金色 　　下面是我改的项目 　　1，扶手箱 　　2，道可视360全景夜市的 　　3，柚木地板 　　4，不锈钢踏板带灯 　　5，航空座椅加前排包皮 　　6，鹿皮绒窗帘 　　7，电视（大篷车） 　　8，小桌板 　　9，九宫格 　　10，星空顶  　　美好的一天从升级车子开始   　　刚出去一会儿回来就已经拆成这样了  　　拆完之后就这样了，薄薄的一成铁皮，建议你们做一成隔音，  　　扶手箱装好了，还带一个220v的电源，可以充手机电脑什么的，还有师傅说不可以用太大电流的东西   　　上面还有一个储蓄的地方，空间挺大，这样杂七杂八的小东西不愁没地放了  　　这是360全景的前视，在中网的中间   　　这是后视，专用的，装在左边，师傅说装在左边比较剧中，视野更广   　　这是左边摄像头打在镜子上  　　右边也是  　　开始拼图了  　　这是前视效果，前后摄像头都有一个随动轨迹线   　　这是后视，  　　左视，没有随动轨迹   　　右视也没有   　　木地板效果，还带个银色的亮条   　　这是后备箱的不错??有个别克标   　　不锈钢带灯踏板，晚上效果奇佳，白天效果不怎样   　　带座椅加热   通风。按摩，  带氛围灯    　　开关效果   　　前面中间位置，  　　后面中间位置    　　中门窗帘好像是鹿皮绒的  　　左边的  　　后面小床   　　后面小窗隐蔽性好  　　电视，大篷车的，分辨率还是1080p的  　　九宫格，星空顶效果，都可以用遥控器控制的   　　小桌板，小巧精致，能放电脑什么的，小孩子还能在上面写作业呢！还有个杯槽   　　两个效果    　　最后给师傅点个赞，幸苦了??
79fada821f384f55b89725fc69ba21bf,1,感觉威霆是风情万种什么改装方案都有哈,"　　威霆车路上多不胜数，随着国家开放二胎后，威霆可算不是商用型，家用也是特别多，车内空间够大，外观那就不用说大气有格局,上2.0T?喷涡轮增压，性价比也高，这车不火才怪哈  　　基本每天上下班都碰到擦肩而过的车友 ，也许是缘分，也许这就是独一无二的威霆  　　两个颜色方案 　　施工项目 　　二排航空座椅 　　三排电动床 　　全车改色 　　游艇木地板 　　中央冰箱 　　云阁顶灯 　　满天星 　　吸顶屏 　　大屏导航 　　前后雷达 　　中网饰条 　　车内23件套饰条 　　行李架                "
0d12e5916c5145e79fd0a1a332fe1d6f,0,刚刚加入请多指教！,　　14年10月刚刚入手！    
349679432dcc47b4888ed48e485f4828,0,刚去看了2529那款,　　无法言语，我只能说，家用还是准备改改吧
1c0cc8bfec0f429e894aaabb4d8c0fca,0,刚提，优惠4万,刚提，优惠4万
