id,flag,title,content
60928624dbd3490199b45da27287c5db,0,高大上程度连雷克萨斯LM也服，别克版“埃尔法”来了，仅4座版,　　高大上程度连雷克萨斯LM也服，别克版“埃尔法”来了，仅4座版 　　在刚刚过去的上海车展，要说最吸睛的MPV当属雷克萨斯LM。 　　LM做工用料按照雷克萨斯的旗舰标准，比加价30万的埃尔法或威尔法都要壕。 　　不过，说起顶级MPV，上汽通用别克也在车展前夜的别克之夜上推出了一款——别克GL8 Avenir概念车。  　　虽说是概念车，估计在量产时，很多高大上的元素也会被保留。 　　前脸采用经典的羽翼式饰条装饰，搭配两侧飞翼式全LED大灯。侧滑门、后排隐私玻璃，配双五辐20英寸轮毂，轮胎是倍耐力高性能胎。  　　真正牛逼的是内饰，以月白与黛蓝为配色，深蓝色植绒顶衬搭配羊绒地毯，并有星空顶灯。  　　至于用料，运用了“大漆”，这是一种非常珍贵的天然树脂涂料，属于国宝级工艺了，借鉴自晋唐青绿山水。 　　座椅布局只提供4座版，前排座椅后面配有两个高清大屏，后排座椅中央的中央扶手类似私人游艇，还打造了一个私密酒柜，绝对是超越头等舱级别的享受。   　　如此高大上，想必连雷克萨斯LM看后，也会有些自卑。 　　当然啦，由于两者品牌尚有差距，估计GL8 Avenir量产后的价格，也会比雷克萨斯LM亲民很多。 
501f3030e6734eb5a6a35daddb17f6ce,0,高顶配应该会，上仨电门 360。。。,高顶配应该会，上仨电门 360。。。
9cbb65796e9c4801a0cc1ac4f2e161b4,0,高速7.9满载。,高速7.9满载。
aea2da6df91341899db486713ccd8209,0,高颜值高内涵 商务MPV奔驰威霆,"　　MPV车型凭着其宽大的乘员空间、轿车的舒适性、和厢式货车功能等非常实用的特点成为许多家庭用车和企业商务活动用车的首选。梅赛德斯-奔驰威霆凭借其专业化、多功能的用途，在上市不到两年的时间内，亦被越来越多的高端MPV用户所青睐。  　　1、外观 　　新车配备了全自动卤素大灯及LED日间行车灯，车头部分前挡风和前箱盖之间折角更小，相比上代将近180度的折角看着更加舒服。前脸部分上下进气格栅相比前一代尺寸更加宽大，下进气格栅延展幅度更广，给人更多豪华霸气的感觉。车身侧面线条凹凸有致，铝合金轮毂采用了五幅风车形状设计，增添了动感。值得一提的是，商务版车型左右两侧都采用了手动滑轨车门，这一设计是精英版本及老款没有的配置，让车主进出车辆时更为便捷。轮胎尺寸为235/55 R17，比上一款车型略大了一圈，较厚的轮胎胎壁保证了舒适性。  　　2、内饰 　　全新威霆的内饰同样采用最新的家族化设计风格，中控台等部分运用了硬塑料材质，整体看起来简洁又具有质感。方向盘采用了如今比较主流的三幅式设计并集成诸多功能按键，与此同时方向盘上增加了点状纹路， 握感很实，整体手感非常出色。仪表盘设计简洁大方，油表盘及水温表盘镶嵌在双仪表盘内。中控台增加了一定的储物空间。另外，5.8英寸彩色夜晶屏幕，集合多媒体系统，并拥有蓝牙、收音机等诸多功能。屏幕下方是哑铃形状的空调控制旋钮及发动机启动停止控制多功能按钮组，视觉效果简洁又时尚。  　　3、空间 　　奔驰新威霆全车长5370mm，宽1928mm，高1880，轴距3430mm。新车型较比上一代车型，在车身尺寸数据方面有了大幅提升。得益于宽大的车身尺寸与轴距，威霆前排乘坐空间非常宽裕，较高的车身姿态可以为驾驶者提供更为宽阔的驾驶视野。座椅配备滑轨系统，后排座椅可以自主调节。并且座椅可以反方向安装，车内乘客可随心所欲的获得更为灵活的空间及乘坐姿态。此外，后排座椅可提供出色的包裹性与支撑性，带来出色的乘坐体验。新威霆的装载能力给人不小的惊喜，方正的后门设计节省出不少的空间。并且，后排座椅可折叠拆卸，进一步增强车辆的装载能力。  　　4、安全 　　全新主动安全防护科技植入包括了注意力辅助系统(ATTENTION ASSIST)、侧风稳定控制辅助系统(SIDE WIND ASSIST)、驻车定位系统(PARKTRONIC)与主动式驻车辅助(ACTIVE PARKING ASSIST)、电控车辆稳定行驶系统(ESP 9i)。轻松避免突发状况，护航一路，畅行无忧。、  　　5、动力 　　其全系车型均装配2.0T M274版涡轮增压汽油发动机以及7挡双离合变速箱，发动机最大功率224Ps（155km）,最大扭矩350Nm，换挡模式仍旧采用奔驰标志性的怀挡形式。   　　奔驰威霆性能与外观的兼顾，简洁明快的设计风格。助力事业激流勇进的风格以及超高性价比。将高端实用主义进行了完美的诠释。"
3db7b1bdf7cc4e2a94f9c5974c61c074,0,哥们19款有双色的吗？,哥们19款有双色的吗？
019c17b3e9384a2ea225a6a3a127f340,1,格林瑞雅改装奔驰威霆内饰果然是专业的,　　外观流水高顶，动感大包围，镀络件围绕车前，奔驰标志熠熠生辉。车身时尚拉丝贴花，车身同色保险杠、防檫条，自动迎宾踏板，右侧电动滑门配置，上车更大空间。  　　内饰方面：奔驰威霆全车柚木地板，真皮座椅，左右电动伸缩小桌板，吃放、电脑办公，随意搭配自己的每天行程。电动窗帘，充分保护乘客舱隐私不被泄露，给你安静祥和的空间。车载全球Bose影院级音响设备，前后舱通话设备，车载空气净化器，缔造完美商务氛围，给你晋升的想象空间。  　　细节方面：打开车门，首先看到的就是一体式豪华吧台——前后舱，内饰高光泽条木修饰和内饰壁灯、氛围灯。吧台享有迷你水晶酒柜，可放置美酒和酒杯，还有咖啡杯架。吧台独有的进口胶囊咖啡机，此时正好派上用场。闲暇时间，煮一杯咖啡，品人生之淡然。舱可拆卸小桌板，节约空间，随拆随用，可娱乐打牌、可商务办公。电动窗帘，车载冰箱空气净化器，220V电压插座，细节体现珍贵。触摸屏一键控制，告别手动，实现电器自动化控制。 　　其他方面：奔驰威霆乘客舱全顶天窗，按钮一按，即可开启和关闭。想要呼吸新鲜的空气，想要在湛蓝的天空下遨游，想要在日月星辰下望流星，一切都可以。 
2220843d897745d2bac684a825e19007,0,个人感觉没必要,个人感觉没必要
77238f236c25468388cab1df50144d33,0,个人觉得你的电瓶撑不了多久了。,个人觉得你的电瓶撑不了多久了。
0dd3cbe98d8c4be9913b0565fa78391c,1,各位的油耗怎样啊 有我的高吗？,                  每次重启后的油耗。现在这车在市区约来越喝油了。也不知道啥原因                      
4e07b19f58d7407187406383f20cf11d,1,各种纠结GL8和艾力绅,                  心中一直一直喜欢GL8，可无奈顶配价格有点偏贵，所以就看了看艾力绅顶配，车还不错，可二排安装儿童座椅比较鸡肋，GL8&nbsp;28T配置又不行，最起码要带前后雷达和倒影，这一下就加了不少钱，各种纠结，想上个顶配吧，可估计老爷子不会给添钱，大家帮帮忙权衡利弊，我应该怎么选…                                                 
784d7856d70c4889ad6ebcc29ff6f545,0,给仇人推荐什么车？别克gl8,　　为什么买别克gl8容易请全村人吃饭。  　　一鹿有车5月8号报到了gl8。 有空的车主看下尤其是私家车。说得太好了。  
09e9dcace8e9460084176dab1706186c,1,给家里再填置一台奔驰商务车！,"　　起初也是朋友购了一辆商务车,每天坐着感觉比轿车和越野车坐着舒服，室内空间也大，不由得燃起了我购买商务车的愿望。于是开始关注v级，上网在汽车之家上查了所有商务车款式、性能、价格，选了性价比比较高的两款车型：奔驰威霆和大众凯路威。老婆说大众凯路威不喜欢，就看奔驰吧！当时也计划着过年的时候全家出去玩，所以购车再次提上议程，论坛逛了几天，发了一咨询贴，让本地汽贸的朋友帮忙打听了一下这个车的行情，之后我跟朋友们一起去4S店开始看车，内饰配置都比较满意，家里已有两台奔驰对奔驰品质还是比较认可的，但是销售说没有优惠"
c30388d2737e4ce1be491b31525ade2d,1,给朋友的推荐,                  朋友问我选商务车的时候什么是最重要的，凭着我这些年的开车经验我觉得商务车最重要的是空间和舒适度。因为商务车肯定会经常坐很多人，而且有时候会避免不了的要放些东西，所以空间一定很重要，还有，商务车可能会经常被用来做商务接待，舒适度高也能给客户留下一个好印象。朋友觉得我说的很有道理，然后就让我帮他推荐几款商务车。正好我最近也在关注商务车，所以就给他推荐了别克GL8和风行CM7。别克GL8有2.0T的排量，动力完全不用担心，自动挡，开着还是比较容易的，高配置电动助力的，方向盘会比较轻，座椅是2+2+3的布局，坐在后排上下车也比较方便，最后一排可以按比例放倒，兼顾了载物，我觉得挺不错的。风行CM7也是2.0T的排量，模拟6挡的自动挡，新出的18款全部采用电动助力，座位布局也是2+2+3，最后一排座椅不仅可以翻折还可以侧挂起来，这样不仅放东西的空间更大，而且还不用担心因为放东西而弄脏座椅，我觉得也不错。我把这两款车都推荐给了朋友，至于哪个更适合他就得他自己选了。                                                 
21f8a46bf4a64ab286a9d2986fc85506,0,更舒适豪华全新GL8 Avenir座椅悬架体验,　　别克GL8 Avenir作为向更高级别市场进军的车型，在外观、配置以及服务上有着相应的提升。而作为一款主打商务牌的MPV，后排的乘坐舒适性是它的基本诉求。下面我们从底盘系统和座椅舒适性上来好好体验一番，看看它能否令我们满意。 　　全新别克GL8采用前麦弗逊、后四连杆的四轮独立悬挂设计。相比老款的后扭力梁式非独立悬架，独立悬挂设计可将两侧车轮运动解耦，有效抑制车轮一侧受到的冲击干扰向另一侧传递，这一改变让其在舒适性上有了质的提升。 　　在部分结构上进行了调整优化，进一步提升了整车的乘坐舒适性。车辆麦弗逊前悬的主销后倾角加大，提升了车辆直线行驶的稳定性。铝制转向节配合空心稳定杆，在非簧下质量更轻，动载荷也更小。而液压衬套的加入，对隔振和抖动的抑制更为有效，也提升了转向响应和舒适性。三通道隔振结构，将来自路面的冲击分别通过弹簧、缓冲块和减振器独立传递至车身，有效分散路面冲击。 　　四连杆独立后悬两下一上的横向连杆布置形式，令侧向刚度得到增强，后桥尺寸和非簧载重量得以减少。后稳定杆采用空心设计，动载荷更小，有效减少车辆侧倾。而减振器与纵臂布置角度的优化，也令减振的效率更高。 　　在路上行驶时，全新的悬架组合给人十分出色的驾乘感受，滤振做的相当到位，在过减速带或井盖时没有多余的弹跳。在历经起伏路面、补丁路面、沥青路面和刻槽水泥路这些较差路段时，车辆前后减震器阻尼力匹配合理，不会让过多的震动传到座椅上。 　　带传动式（Belt-Drive）电动助力转向系统，具备随速可调助力和主动回正功能，经过专业调校的方向盘抖动抑制功能，在过滤路面冲击的同时为驾驶员提供清晰的路感。GL8 Avenir加强了车辆的NVH，使用了马牌PROCONTACT系列静音轮胎，都是为了提供更好的行车静谧性。而实际的体验也是很不错的，时速80km/h，只有风噪比较明显，后排的静音性也明显好于前排。 　　2.0T发动机可提供260马力和350牛?米充沛动力，推动近2吨的GL8还是很轻松的。油门设定的也很线性，涡轮介入也并不突兀，起步、加速的反应时间把控的很合适。对于这样一台MPV车型，谁也不会把它当成一部驾驶机器，把乘客舒舒服服从A点送到B点，才是它最重要的工作。 　　带传动式（Belt-Drive）电动助力转向系统，具备随速可调助力和主动回正功能，经过专业调校的方向盘抖动抑制功能，在过滤路面冲击的同时为驾驶员提供清晰的路感。GL8 Avenir加强了车辆的NVH，使用了马牌PROCONTACT系列静音轮胎，都是为了提供更好的行车静谧性。而实际的体验也是很不错的，时速80km/h，只有风噪比较明显，后排的静音性也明显好于前排。 　　2.0T发动机可提供260马力和350牛?米充沛动力，推动近2吨的GL8还是很轻松的。油门设定的也很线性，涡轮介入也并不突兀，起步、加速的反应时间把控的很合适。对于这样一台MPV车型，谁也不会把它当成一部驾驶机器，把乘客舒舒服服从A点送到B点，才是它最重要的工作。 　　坐垫采用DHH垂直双硬度发泡工艺，即在泡沫不同区域实现垂直方向的硬度区分，通过更多的接触面积减少了长时间乘坐而导致的人体疲劳感累积，既兼顾了良好的表面柔软性，又能够保证平均的压力分布，为长途乘坐带来更好的舒适性。 　　一体式电动调节腿托，通过八连杆联动展开的模块化设计，最大展开角度达到60°，配合可调角度达到70°的电动椅背。如果将将靠背和腿托调节到最大角度时，乘客基本处于完全平躺状态了。但两侧的扶手角度不可继续向下调整，在平躺后两侧手臂的角度有些尴尬。侧翼六向可调头枕提供了更大的头部接触面积，不仅提升头部贴合度和支撑感，乘客还可通过前后调节，令头枕更贴合颈部，使头枕在发生碰撞时充分发挥吸能作用。 　　同时我们还来到了GL8座椅实验室进行了深入了解，可以感受到设计人员在座椅上下足功夫，实现了舒适性、安全性与功能性的全覆盖。这样一个我们日常乘坐的座椅要通过乘员进出、颠簸试验、靠背耐久调节试验、老化耐久试验、VIAQ化学试验、振动噪音试验、靠背疲劳试验、压力分布试验和安全气囊点爆试验，充分保证了座椅的实用性和耐久性。 　　总结：全新GL8在内部空间优化、座椅舒适性升级、动力及底盘系统的改善上都表现的可圈可点，许多细节上的改变也让我们看出它正在向家用和高端市场靠近。而新车售价基本维持原来的水平，足显其诚意。相信在今后一段时间内，全新别克GL8仍然会占据国内商务MPV一哥的地位。
d8b20f336cb64db995cd487b57316018,1,公司迎来新成员，GL8今天提车！,　　因公司业务需要，也因为个人想买车，就准备以公司名义买个商务车座的，这样话公司要接待贵宾就会很方便，也可以用作家庭使用，可以带家老出去旅游.有这个念头我就开始看车，先从公司角度开始考虑要买个品牌硬点的车，又要兼顾家庭买辆实惠和舒适度高的车，刚开始我看中奔驰的唯雅诺，很满意，价格也适中，主要看中奔驰这个品牌有档次，开出去接待贵宾有面子，还有一个真的是因为外观看，严肃的说下我是外貌协会的，然后我就跟同事来去看车了。先去看的唯雅诺，奔买车的兴奋的心情去看车，一眼就看中这款车了，因为之前都在网看的，现在看到实物也很满意，就跟销售顾问谈价格想把车给订了。没想到没有现车要等一两个月还要加价，而且价格也超出我们的预算，所以当时的心情差，就跟同事走了。后来同事说去看下GL8吧！就去别克，听接待的人讲GL8今年刚出来的，顿时眼前一亮，我们当时在展厅看到的是高配豪华版399900的这款，一眼我就相中了，不管外观还是内饰都很吸引我，而且价格也在我们的预算之内，当时销售顾问跟我介绍一下这个配置我满意，就看了不到10分钟我就决定订这款车，当时他们销售顾问还问我为什么这么快就订车。我就说便宜而且性能好，所以就毫不犹豫的给订了，今天到4S店拿车，上图给大家看看，车还没有使用，后续用的好我再来   　　求版主给个精华   　　霸气的大脸，当时销售顾问介绍这款前脸的时候说前面像自由女神飞翔的样子，很带感，我自己觉得很像   　　灯像鹰眼一样很霸气有没有觉得  　　侧身门把手，两个门重合一起就是整个的，看上去整体感很强，据说这个只有高档车才能做到这种，所以可想而知现在别克也已经往高端品牌发展了   　　电动门，很人性化也很方便，有了这个电动门，一下这个档次就上去  　　这个是整体的一个侧面照，有么有很大气    　　后备箱很宽敞，门是电动的，最主要这里有个功能我很满意，就是带一家老小出去玩的 时候手上可能拿很多东西，没有手开后备箱，这个时候只要你腿在下面一扫就可以将后备箱打开，是有感应的，这个功能真的很高端啊  　　后备箱这里有个储物格，当时的销售顾问跟我说这里可以放一些名烟名酒，因为经常出去请客吃饭，放在里面有可能会招小偷，放在这里面就可以放心，没有人能看到，对他这个解释我觉得很人性化  　　马牌的轮胎，大家都知道马牌的特点就是贵啊、采用是17寸的轮毂，轮毂就像梅花一样漂亮，开起来很拉风也很炫，正好符合我的特质 　　、  　　内饰和中控台，这个中控台很有科技感哦，档位跟其他车里的档位不一样，其他车都在中间，这款车在前面，这样就很方便驾驶员的操作，而且都是触屏的，很先进，时尚  　　座椅是棕色的，当时销售顾问跟我说这是他们那卖的最好的，这个颜色很稳重，很洋气，最主要就是耐脏，而且这个座椅采用的是太空椅，根据人体工程学定制的，还有腿托，这样经常跑长途时间长的话也不会觉得累了，一家老小出去旅游时也可以让老人坐前面两个位置  　　驾驶员的座椅功能很多  　　这个是电动座椅可以随意调节，调整到舒适的角度  　　第二排座椅也可以有很多方位调节  　　迎宾踏板，晚上会发光，也是一个特色   　　天窗是全景的哦！虽然只能打开前面的，但后面的天窗遮阳帘也可以打开，这样坐在里面感觉不会闷，觉得心里会很舒畅  　　这个里面的箱子，介绍说是里面有一些随车的工具之类的，具体什么我还没有打开看过  　　这个小的储物盒可以放油卡或者行驶证之类的，想的也比较周全  　　我发一篇提车贴4S店送我原厂的晾衣架，我觉得我的提车感受可以给大家借鉴下，不是为了这个礼品。安装好了还不错，暂且为4S店点个赞吧！求版主给个精华，跪谢 
23d4b14d1f6341f69e7c80ed4cdc9c72,0,恭喜恭喜，开始你的改装之路吧。,恭喜恭喜，开始你的改装之路吧。
1b6d6c0c7dd945379a80ad9374cebd81,1,恭喜提车，不过话说楼主这不是陆尊，陆尊只有3.0，这是gl8经典版也是常说的丐版，我的二手陆尊3.0，内饰，座椅非常满意，丐版座椅减配用了以前老gl8的，第三排没有陆尊可以前后移动，靠背调节，当年陆尊丐版CT价格都是33起步呀，丐版指导价才是20多,恭喜提车，不过话说楼主这不是陆尊，陆尊只有3.0，这是gl8经典版也是常说的丐版，我的二手陆尊3.0，内饰，座椅非常满意，丐版座椅减配用了以前老gl8的，第三排没有陆尊可以前后移动，靠背调节，当年陆尊丐版CT价格都是33起步呀，丐版指导价才是20多
f44e13e240154c1cb39e2dc4cbb39a6a,0,估计错了吧，五十度你知道是多陡的坡么，你车如果停在五十度角的坡上每天进进出出，保证半年变速箱就报废。,估计错了吧，五十度你知道是多陡的坡么，你车如果停在五十度角的坡上每天进进出出，保证半年变速箱就报废。
6d2bce80ff464a72afc7f5909b0904a2,0,估计是电瓶没电了,估计是电瓶没电了
47f2074915d0476796b9c58cabdba21a,0,故障率会让你后悔的！,故障率会让你后悔的！
281784c15a5b48e0823bb397492ae8cc,0,关于gl8加装低音炮的问题。,　　在某东家看上此款低音炮，不知道有没有哪位大神改过低音炮的，说说效果，谢谢。 
1002806daa1441b29abf0c16e9187f8f,0,关于二手车贬值率的这个问题，正常车辆的前五年是以15%、13%、10%、8%、7%这标准来贬值的（有的车型高，有的车型偏低），之后以每年车价的5%贬值。这个只是客观因素。一辆二手车残值的剩余价值是要根据以下几点来判定的：车龄、保养、性能进行综合评定的。已经贬值到了一定程度之后也就是每年最多5%了。,关于二手车贬值率的这个问题，正常车辆的前五年是以15%、13%、10%、8%、7%这标准来贬值的（有的车型高，有的车型偏低），之后以每年车价的5%贬值。这个只是客观因素。一辆二手车残值的剩余价值是要根据以下几点来判定的：车龄、保养、性能进行综合评定的。已经贬值到了一定程度之后也就是每年最多5%了。
3073f53bd513417b8a6a5ccc1bfc41e7,0,关于陆尊第三排座椅加滑轨,　　关于陆尊第三排座椅加滑轨 　　我的是陆尊3.0，2007年的，第三排本来就可以滑动，某宝上小二有的说可以叠加滑轨，有的说不可以，只能替换。 　　如果叠加或替换，增加的滑动行程不大（前后各少于10厘米），改动意义就不大了。 　　如果叠加，滑到尽头，会不会造成座椅重心不稳？ 　　再，中排改旋转，效果怎么样？ 　　请改过的车友提供个意见，谢谢！ 
0a60c5961ad248eda154016bfada8e8f,1,关于新车V260L的车载娱乐显示屏问题,                  用了车载娱乐显示屏10多天，突然发现这个显示屏会自动黑屏，不知道是我操作原因还是什么？哪位朋友知道的麻烦告诉下，谢谢了。                      
715b9e17640746f7bfdcf8bc3a751877,0,关注 私个价格,关注 私个价格
2652fcff437a4e948069b29e21c26954,0,关注了，多少出,关注了，多少出
df1c3921f1c1485aa6a88792626dded8,0,关注了私信,关注了私信
83964286eecf4225a5a74b114a6d9bd5,0,关注你了。麻烦你关注我一下私聊下价格。,关注你了。麻烦你关注我一下私聊下价格。
77af475c035d4e0a9afb27bca022d915,0,关注私信你,关注私信你
8c5b1c0afac14418bb74b7767759defd,0,关注一下吧，私信你了,关注一下吧，私信你了
97237511667a45719ab07add8186260f,1,光发文字没人回复，上视频，16款埃尔法怠速振动,                  最近才发现的问题，怠速开空调挂D档振动的特别厉害，视频里我分别开空调和不开空调挂了D档和N档，不开空调明显好很多，挂N档也会好一点，视频拍出来的水面振动比较慢，实际上会快很多，而且实际驾驶感受就是怠速D档开空调，振的你心都麻麻的，耳朵都是嗡嗡的，没办法开，可能我驾驶习惯红灯就踩刹车，有的朋友会说等红灯挂N档，但是我觉得这肯定是哪有问题，去4s检查说没问题，也遇到两辆埃尔法，也是这毛病，但没我的明显，油路清洗了，空气空调滤芯都换了，没卵用，不说加价，这7，80万的车振成这样还真是少见，还有前挡玻璃也吐槽下，2个月前，跑高速下来发现被石子崩裂了，当时没听到明显的声音可能是自己没注意，然后拖了几天没去补，有一天车内外温差大，导致裂到玻璃边缘了，没办法补了，就去4s店换了一块，连工时好像是5700，然后前天又他妈裂了，我这次跑的是省道啊，60左右的速度，前面也没大车，也没听到声音，可能是我太背了？我比较过我开过的别克，路虎，奔驰，从眼观察和手摸都觉得埃尔法的前挡薄很多，难道是我心里作用？最后再吐槽下这7，80万的车，前排没通风，这个天真的很难受。我不是车黑也不是司机，我是家用的，只想有高手朋友帮忙解决怠速开空调振动这个问题，玻璃我也觉得没办法说清楚，这次不等它全裂了不换，希望换第三块别再这么快就裂了哈哈http://pan.baidu.com/s/1kVSi0ej                                                 
ad413115792043918d91ccac47b297ce,0,广东地区哪里还有双手悠享版？,　　有资源的麻烦告知一下 
0fcf9dc687db46c0979cecef20c1cdd8,0,广东有现车的都是加二十啊，高配，威二法也是一样,广东有现车的都是加二十啊，高配，威二法也是一样
a0d867a1d02a4715be30ee136978a9c6,0,广州入手V260L尊贵加长版,　　前几天在广州某4S订的车，裸车55.3万。事后感觉买贵了
a971ac9732314344bd7764ba930e5b70,0,广州优惠多大呢？,广州优惠多大呢？
